Vampiric Well Drinks,"Until the start of your next turn, any time a creature you control is dealt damage, you gain 2 life.",,"Whenever a creature [controllingPlayer] controls is dealt damage, they gain 2 life.",DIFF,418,418,duel,TRUE,custom,,Necromancy,Round,common,Reminder,,,,,,Life,Player,FALSE,FALSE,FALSE,FALSE,FALSE,FALSE,FALSE,TRUE,FALSE,
Taxation,Take the top card of each opponent's library and put it in your hand.,,,DIFF,419,419,duel,TRUE,custom,,Divination,Instant,uncommon,,,,,,,Cards,"Player, Opponent",FALSE,FALSE,FALSE,TRUE,FALSE,FALSE,FALSE,FALSE,FALSE,
Class Warfare,Destroy all non-land cards with a Common rarity.,,,DIFF,420,420,duel,TRUE,"exemplar, custom",badthings,Evocation,Instant,common,,,,,x,,Destruction,All,FALSE,FALSE,FALSE,FALSE,FALSE,TRUE,FALSE,FALSE,FALSE,Rarity Matters
Midrange Massacre,Destroy all cards with an Uncommon rarity.,,,DIFF,421,421,duel,TRUE,"exemplar, custom",badthings,Evocation,Instant,common,,,,,x,,Destruction,All,FALSE,FALSE,FALSE,FALSE,FALSE,TRUE,FALSE,FALSE,FALSE,Rarity Matters
Robespierre,Each player sacrifices all cards they control with a Rare rarity.,,,DIFF,422,422,duel,TRUE,"exemplar, custom",badthings,Necromancy,Instant,uncommon,,,,,x,,Destruction,All,FALSE,FALSE,FALSE,FALSE,FALSE,FALSE,FALSE,TRUE,FALSE,Rarity Matters
Just A Little Off The Top,Exile all cards with a Mythic Rare rarity.,,,DIFF,423,423,duel,TRUE,"exemplar, custom",badthings,Abjuration,Instant,uncommon,,,,,x,,Destruction,All,TRUE,FALSE,FALSE,FALSE,FALSE,FALSE,FALSE,FALSE,FALSE,Rarity Matters
That'll Buff Right Out,Choose a rarity. Put a +1/+1 counter on each creature of the chosen rarity.,,,DIFF,424,424,duel,TRUE,"exemplar, custom",complexity,Transmutation,Instant,common,,,,,c,,Buff,All,FALSE,FALSE,FALSE,FALSE,FALSE,FALSE,FALSE,FALSE,TRUE,Rarity Matters
Common Courtesy,"Put a ""Protection from Commons"" counter on target creature.",,,DIFF,425,425,duel,TRUE,custom,,Transmutation,Instant,common,,,,,,,Buff,Creature,FALSE,FALSE,FALSE,FALSE,FALSE,FALSE,FALSE,FALSE,TRUE,Rarity Matters
Mulched,"For each permanent type, choose a permanent of that type in your graveyard and put it into the battlefield.",,,DIFF,426,426,duel,TRUE,custom,,Necromancy,Instant,uncommon,,,,,,,Cards,Player,FALSE,FALSE,FALSE,FALSE,FALSE,FALSE,FALSE,TRUE,FALSE,
Land Grab,Choose target opponent. Gain control of all lands they control until end of turn. Untap those lands.,,,DIFF,427,427,multi,TRUE,"lite, exemplar, custom",main,Enchantment,Turn,uncommon,,,,x,y,075,Control,Target Opponent,FALSE,FALSE,FALSE,FALSE,TRUE,FALSE,FALSE,FALSE,FALSE,
Rarity Charity,Gain control of all non-land permanents with a Common rarity until end of turn.,,,DIFF,428,428,duel,TRUE,custom,,Enchantment,Turn,uncommon,,,,,,,Control,All,FALSE,FALSE,FALSE,FALSE,TRUE,FALSE,FALSE,FALSE,FALSE,Rarity Matters
Uncommon Courtesy,Gain control of all permanents with an Uncommon rarity until end of turn.,,,DIFF,429,429,duel,TRUE,custom,,Enchantment,Turn,uncommon,,,,,,,Control,All,FALSE,FALSE,FALSE,FALSE,TRUE,FALSE,FALSE,FALSE,FALSE,Rarity Matters
Rarified Heir,Gain control of all permanents with a Rare rarity.,,,DIFF,430,430,duel,TRUE,custom,,Enchantment,Instant,rare,,,,,,,Control,All,FALSE,FALSE,FALSE,FALSE,TRUE,FALSE,FALSE,FALSE,FALSE,Rarity Matters
Trust Fund Baby,"Gain control of all permanents with a Mythic Rare rarity. For each permanent you gain control of in this way, create a token that's a copy of it, except the token isn't legendary if it is legendary.",,,DIFF,431,431,duel,TRUE,custom,,"Enchantment, Conjuration",Instant,rare,,,,,,,Control/Token,All,FALSE,FALSE,TRUE,FALSE,TRUE,FALSE,FALSE,FALSE,FALSE,Rarity Matters
Antique Roadshow,"Choose a rarity. Exile all nontoken permanents of the chosen rarity. Shuffle these cards together. Starting with you and going in direction of play, deal the exiled cards to each player. That player puts them onto the battlefield tapped under their control.",,,DIFF,432,432,duel,TRUE,custom,,Enchantment,Instant,rare,,,,,,,Cards,All,FALSE,FALSE,FALSE,FALSE,TRUE,FALSE,FALSE,FALSE,FALSE,Rarity Matters
Generosity,Create Rarity.,"Create a 2/2 blue, black, and red Rarity unicorn creature token with Lifelink, ""<z-is>r</z-is>: Target creature gains +0/+1 until end of turn."", and ""Whenever Rarity deals combat damage to a player, draw a card.""",,DIFF,433,433,duel,TRUE,"exemplar, custom",tokenizer,Conjuration,Instant,uncommon,Rarity,,,,fim,,Token,Player,FALSE,FALSE,TRUE,FALSE,FALSE,FALSE,FALSE,FALSE,FALSE,Ponies
Honesty,Create Applejack.,"Create a 2/4 red, green, and white Applejack pony creature token with Vigilance, Indestructible, and ""<z-is>r</z-is>: Applejack gets +1/+0 until end of turn.""",,DIFF,434,434,duel,TRUE,"exemplar, custom",tokenizer,Conjuration,Instant,uncommon,Applejack,,,,fim,,Token,Player,FALSE,FALSE,TRUE,FALSE,FALSE,FALSE,FALSE,FALSE,FALSE,Ponies
Laughter,Create Pinkie Pie.,"Create a 3/3 black, green, and red Pinkie Pie pony creature token with  ""<z-is>1</z-is>: roll a six-sided die. 1 - Deal 1 damage to target creature. 2 - Pinkie Pie gains +1/+1 until end of turn. 3 - Create a 0/1 green Gummy creature token. 4 - Draw a card. 5 - Pinkie Pie gains indestructible until end of turn. 6 - Tap target creature."" and ""If more than <z-is>3</z-is> is spent this way in a single turn, sacrifice Pinkie Pie at end of turn.""",,DIFF,435,435,duel,TRUE,"exemplar, custom",tokenizer,Conjuration,Instant,uncommon,Pinkie Pie,,,,fim,,Token,Player,FALSE,FALSE,TRUE,FALSE,FALSE,FALSE,FALSE,FALSE,FALSE,Ponies
Loyalty,Create Rainbow Dash.,"Create a 4/2 green, red, and blue Rainbow Dash pegasus creature token with Flying, Haste, and ""<z-is>t</z-is>: prevent all combat damage that would be dealt this turn.""",,DIFF,436,436,duel,TRUE,"exemplar, custom",tokenizer,Conjuration,Instant,uncommon,Rainbow Dash,,,,fim,,Token,Player,FALSE,FALSE,TRUE,FALSE,FALSE,FALSE,FALSE,FALSE,FALSE,Ponies
Magic,Create Twilight Sparkle.,"Create a 2/3 blue, white, and black Twilight Sparkle unicorn creature token with Hexproof, Lifelink, and ""<z-is>t</z-is>: Deal 2 damage to target creature.""",,DIFF,437,437,duel,TRUE,"exemplar, custom",tokenizer,Conjuration,Instant,uncommon,Twilight Sparkle,,,,fim,,Token,Player,FALSE,FALSE,TRUE,FALSE,FALSE,FALSE,FALSE,FALSE,FALSE,Ponies
Kindness,Create Fluttershy.,"Create a 1/5 white, green, and blue Fluttershy pegasus creature token with Flying, Defender, and ""Each time Fluttershy blocks, create a 1/1 green Squirrel creature token and a 0/1 blue Songbird creature token with flying.""",,DIFF,438,438,duel,TRUE,"exemplar, custom",tokenizer,Conjuration,Instant,uncommon,Fluttershy,,,,fim,,Token,Player,FALSE,FALSE,TRUE,FALSE,FALSE,FALSE,FALSE,FALSE,FALSE,Ponies
Not Quite Trogdor,Create Spike The Dragon.,"Create a 0/1 black and red Spike The Dragon whelp creature token with Flying and ""<z-is>t</z-is>: Destroy target artifact. Put a +1/+1 counter on Spike.""",,DIFF,439,439,duel,TRUE,"exemplar, custom",tokenizer,Conjuration,Instant,uncommon,Spike The Dragon,,,,fim,,Token,Player,FALSE,FALSE,TRUE,FALSE,FALSE,FALSE,FALSE,FALSE,FALSE,
Friendship is Magic,"Players vote: friendship or winning.<ul><li>Friendship: put a +1/+1 counter on each creature, each player shuffles their graveyard into their library, and each player gains 10 life.</li><li>Winning/tie: each player loses 5 life and should feel bad that you all decided winning was more important than friendship.</li><ul>",,,VOTE,440,440,multi,TRUE,"exemplar, custom",complexity,"Transmutation, Necromancy",Instant,uncommon,,,,,fim,,Vote,Player,FALSE,FALSE,FALSE,FALSE,FALSE,FALSE,FALSE,TRUE,TRUE,Ponies
Self-Control,Gain control of all cards on the battlefield that you own.,,,DIFF,441,441,duel,TRUE,custom,,Enchantment,Instant,common,,,,,,,Control,All,FALSE,FALSE,FALSE,FALSE,TRUE,FALSE,FALSE,FALSE,FALSE,
Poor Impulse Control,Tap all creatures. Copy each activated ability on each creature with <z-is>t</z-is> in its cost.,,,DIFF,442,442,duel,TRUE,custom,,"Enchantment, Evocation",Instant,rare,,,,,,,Control,All,FALSE,FALSE,FALSE,FALSE,TRUE,TRUE,FALSE,FALSE,FALSE,
Toxic Personality,SPECIAL EFFECT,<z-rb>1d6</z-rb>. Deal 2X damage to each other player. You get X poison counters.,,DIFF,443,443,duel,TRUE,"exemplar, custom",toxin,"Evocation, Conjuration",Instant,uncommon,,,,,i,,Poison,Player,FALSE,FALSE,TRUE,FALSE,FALSE,TRUE,FALSE,FALSE,FALSE,
Immunity to Iocaine,You may ignore 704.5c and 704.5u whenever state-based actions are checked.,You may ignore 704.5c and 704.5u whenever state-based actions are checked. (You cannot lose the game due to poison counters.),[controllingPlayer] cannot lose the game due to poison.,DIFF,444,444,duel,TRUE,"exemplar, custom",toxin,Abjuration,Round,common,Reminder,,,,i,,Poison,Player,TRUE,FALSE,FALSE,FALSE,FALSE,FALSE,FALSE,FALSE,FALSE,
Actionable Analytics,"X is equal to the converted mana cost shared by the most nonland permanents you control. (If there is more than one, choose one.) Destroy all permanents with converted mana cost X controlled by your opponents.",,,DIFF,445,445,duel,TRUE,custom,,Evocation,Instant,uncommon,,,,,,,Destruction,All,FALSE,FALSE,FALSE,FALSE,FALSE,TRUE,FALSE,FALSE,FALSE,
Biorhythm,Each player's life total becomes the number of creatures he or she controls.,,,DIFF,446,446,duel,TRUE,custom,,Necromancy,Instant,uncommon,,,,,,220,Life,Player,FALSE,FALSE,FALSE,FALSE,FALSE,FALSE,FALSE,TRUE,FALSE,
Grave-ity Well,"Until the start of your next turn, anytime a card would be put into any graveyard, it is put in your graveyard instead.",,"Whenever a card would be put into any graveyard, it is put in [controllingPlayer]'s graveyard instead.",DIFF,447,447,duel,TRUE,"exemplar, custom",main,Necromancy,Round,common,Reminder,,,,y,,Cards,All,FALSE,FALSE,FALSE,FALSE,FALSE,FALSE,FALSE,TRUE,FALSE,
Chump-B-Gone,Creatures with a base toughness of 2 or less cannot block this turn.,,,DIFF,448,448,duel,TRUE,custom,,Abjuration,Turn,common,,,,,,,Buff,All,TRUE,FALSE,FALSE,FALSE,FALSE,FALSE,FALSE,FALSE,FALSE,
Suddenly Reduced Illusory Briny Serendib Queen,All creatures have base power and toughness of 0/2 and lose all abilities until end of turn.,,,DIFF,449,449,duel,TRUE,"lite, custom",,Transmutation,Turn,common,,,,x,,,Buff,All,FALSE,FALSE,FALSE,FALSE,FALSE,FALSE,FALSE,FALSE,TRUE,
Reschedule Game Night,"Each player chooses and exiles a non-stolen permanent they own. At the beginning of their first turn in the next game of Chaos Magic they play, put this exiled permanent into play under their control.",,,DIFF,450,450,duel,TRUE,custom,,"Chronomancy, Abjuration",Instant,rare,,,,,,,Meta,Player,TRUE,TRUE,FALSE,FALSE,FALSE,FALSE,FALSE,FALSE,FALSE,
Beat-stroid,Distribute up to five +1/+1 counters among up to five target creatures with flying.,,,DIFF,451,451,duel,TRUE,"exemplar, custom",beat,Transmutation,Instant,common,,,,,b,411,Buff,Player,FALSE,FALSE,FALSE,FALSE,FALSE,FALSE,FALSE,FALSE,TRUE,Beatings
Beat-eor,Distribute up to five +1/+1 counters among up to five target creatures without flying.,,,DIFF,452,452,duel,TRUE,"exemplar, custom",beat,Transmutation,Instant,common,,,,,b,412,Buff,Player,FALSE,FALSE,FALSE,FALSE,FALSE,FALSE,FALSE,FALSE,TRUE,Beatings
Beat-eorite,Distribute up to five +1/+1 counters among up to five target lands.,,,DIFF,453,453,duel,TRUE,"exemplar, custom",beat,Transmutation,Instant,common,,,,,b,413,Buff,Player,FALSE,FALSE,FALSE,FALSE,FALSE,FALSE,FALSE,FALSE,TRUE,Beatings
Beat 'Em Up,"Two target creatures fight. The winner (creature that survives or if both survive, whichever dealt the most damage) gets a +1/+1 counter and fights another target creature.",,,DIFF,454,454,duel,TRUE,"exemplar, custom",beat,"Enchantment, Transmutation",Instant,common,,,,,b,410,Buff/Damage,Creature,FALSE,FALSE,FALSE,FALSE,TRUE,FALSE,FALSE,FALSE,TRUE,Beatings
#ForTheKids,"You may donate $25 to Extra Life. If you do, you win the game.",,,DIFF,455,455,duel,TRUE,custom,,Chronomancy,Instant,uncommon,,"Dan F (RIP, my friend)",,,,,Meta,Player,FALSE,TRUE,FALSE,FALSE,FALSE,FALSE,FALSE,FALSE,FALSE,Charity
Lending Library,"Until the start of your next turn, whenever a player draws a card, they must draw it from a library other than their own.",,"Whenever a player draws a card, they must draw it from a library other than their own.",DIFF,456,456,duel,TRUE,"exemplar, custom",main,Divination,Round,common,Reminder,,,,y,,Cards,All,FALSE,FALSE,FALSE,TRUE,FALSE,FALSE,FALSE,FALSE,FALSE,
Subscription Service,"Exile the top 6 cards of your library facedown. During your turn, you may pay <z-is>2</z-is> to play any one of those cards without paying it's normal casting cost. At the end of your turn, place the remaining cards at the bottom of your library.",,,DIFF,457,457,duel,TRUE,custom,,"Divination, Evocation",Turn,uncommon,,,,,,,Cards,Player,FALSE,FALSE,FALSE,TRUE,FALSE,TRUE,FALSE,FALSE,FALSE,
Real Estate Broker,"Swap your library with one you own that is not currently in play. If none are available, draw a card instead.",,,DIFF,458,458,duel,TRUE,custom,,"Enchantment, Divination",Instant,rare,,,,,,,Meta,Player,FALSE,FALSE,FALSE,TRUE,TRUE,FALSE,FALSE,FALSE,FALSE,
Friendly Bant-er,"Until the end of the turn: Untapped white creatures get +0/+5, tapped green creatures get +5/+0, and blue creatures have ""<z-is>1</z-is>, <z-is>t</z-is>: Draw a card.""",,,DIFF,459,459,duel,TRUE,custom,,Transmutation,Turn,common,,,,,,,Buff,All,FALSE,FALSE,FALSE,FALSE,FALSE,FALSE,FALSE,FALSE,TRUE,
Tough Choice,Target opponent chooses: All creatures you control gain [+2/+1] or [+1/+2] until end of turn.,,,DIFF,460,460,duel,TRUE,custom,,Transmutation,Turn,common,,,,,,,Buff,"Player, Opponent",FALSE,FALSE,FALSE,FALSE,FALSE,FALSE,FALSE,FALSE,TRUE,
Gift of Ma'rûf,Choose a card you own from outside the game and put it in another player's hand.,,,DIFF,461,461,duel,TRUE,custom,,Divination,Instant,uncommon,,,,,,,Cards,Player,FALSE,FALSE,FALSE,TRUE,FALSE,FALSE,FALSE,FALSE,FALSE,
Shaky Allegiances,"For each player, choose a creature they control. Gain control of chosen creatures until end of turn.",,,DIFF,462,462,duel,TRUE,"exemplar, custom",complexity,Enchantment,Turn,common,,,,,c,,Control,All,FALSE,FALSE,FALSE,FALSE,TRUE,FALSE,FALSE,FALSE,FALSE,
Master Blaster,Target creature becomes Master Blaster.,"Target creature becomes an artifact with Equip: <z-is>0</z-is> and ""Equipped creature gains +X/+Y where X is this creature's power and Y is toughness."" and ""Equipped creature gains all of this creature's abilities.""",,DIFF,463,463,duel,TRUE,custom,,Transmutation,Instant,rare,Alteration,,,,,,Transmutation,Creature,FALSE,FALSE,FALSE,FALSE,FALSE,FALSE,FALSE,FALSE,TRUE,
Beat-theon,Distribute up to five +1/+1 counters among up to five target enchantments.,,,DIFF,464,464,duel,TRUE,"exemplar, custom",beat,Transmutation,Instant,uncommon,,,,,b,414,Buff,Player,FALSE,FALSE,FALSE,FALSE,FALSE,FALSE,FALSE,FALSE,TRUE,Beatings
Beat-iest,Distribute up to five +1/+1 counters among up to five target permanents.,,,DIFF,465,465,duel,TRUE,"exemplar, custom",beat,Transmutation,Instant,common,,,,,b,415,Buff,Player,FALSE,FALSE,FALSE,FALSE,FALSE,FALSE,FALSE,FALSE,TRUE,Beatings
Beat-y Player One,Distribute up to five +1/+1 counters among up to five target players.,,,DIFF,466,466,duel,TRUE,"exemplar, custom",beat,Transmutation,Instant,uncommon,,,,,b,416,Buff,Player,FALSE,FALSE,FALSE,FALSE,FALSE,FALSE,FALSE,FALSE,TRUE,Beatings
Beat Juice,Gain 1 life for each +1/+1 counter on you and all permanents you control.,,,DIFF,467,467,duel,TRUE,"exemplar, custom",beat,Necromancy,Instant,uncommon,,,,,b,417,Life,Player,FALSE,FALSE,FALSE,FALSE,FALSE,FALSE,FALSE,TRUE,FALSE,Beatings
Food Fight,"Each player creates 2d4 Food. Until the start of your next turn, Food becomes 2/3 artifact creatures with delicious and haste.",,Food is a 2/3 artifact creature in addition to other types and has delicious and haste.,DIFF,468,468,duel,TRUE,custom,,"Conjuration, Transmutation ",Round,common,,HaruhiKing,,,,XX,Token,Player,FALSE,FALSE,TRUE,FALSE,FALSE,FALSE,FALSE,FALSE,FALSE,
Loki,Create a Chaos Deity.,"Create a 5/5 white, green, black, red, and blue Chaos Deity Legendary Enchantment Creature - God token with Indestructible, ""As long as your devotion to generic is less than eight, Chaos Deity isn't a creature."", and ""During your upkeep, if Chaos Deity is a creature, flip a coin. If you win the flip, gain control of target permanent. If you lose the flip, random opponent gains control of Chaos Deity.""",,DIFF,469,469,duel,TRUE,custom,,Conjuration,Instant,rare,Chaos Deity,,,,,450,Token,Player,FALSE,FALSE,TRUE,FALSE,FALSE,FALSE,FALSE,FALSE,FALSE,Chaos
Anchorman,"Until the start of your next turn, every time a spell is cast, roll a d100: 01-60 - the spell is cast normally 61-00 - the spell is countered.",,"Whenever a spell is cast, roll a d100:<ul><li>01-60—The spell is cast normally.</li><li>61-00—The spell is countered.</li></ul>",DIFF,470,470,duel,TRUE,custom,,Evocation,Round,uncommon,Reminder,,,,,,Cards,All,FALSE,FALSE,FALSE,FALSE,FALSE,TRUE,FALSE,FALSE,FALSE,
Demi Zeno,Each player loses life equal to half your current life total (rounded down).,,,DIFF,471,471,duel,TRUE,custom,,Necromancy,Instant,uncommon,,,,,,,Damage,All,FALSE,FALSE,FALSE,FALSE,FALSE,FALSE,FALSE,TRUE,FALSE,
PT Cruiser,Target creature you control swaps power and toughness with target creature opponent controls.,,,DIFF,472,472,duel,TRUE,custom,,Transmutation,Instant,uncommon,Alteration,,,,,,Cards,Creature,FALSE,FALSE,FALSE,FALSE,FALSE,FALSE,FALSE,FALSE,TRUE,
Drunken Feldon,Shuffle target opponent's graveyard into your library and your graveyard into their library.,,,DIFF,473,473,duel,TRUE,"lite, exemplar, custom",main,Necromancy,Instant,common,,,,x,y,,Cards,Target Opponent,FALSE,FALSE,FALSE,FALSE,FALSE,FALSE,FALSE,TRUE,FALSE,
Anubis Round,"Until the start if your next turn, any time a creature would go into a graveyard from play, if its base power and toughness are equal, it is placed into its owner's hand instead.",,"Whenever a creature would die, if its base power and toughness are equal it is placed into its owner's hand instead.",DIFF,474,474,duel,TRUE,"exemplar, custom",main,Necromancy,Round,common,Reminder,,,,y,,Cards,All,FALSE,FALSE,FALSE,FALSE,FALSE,FALSE,FALSE,TRUE,FALSE,
Face/Off,"Swap seats with target opponent: Exchange life totals, emblems, and other player-attached assets with that player, exchange control of all permanents you and that player control, and exchange cards in your hands, cards in your libraries, and cards in your graveyards.",,,DIFF,475,475,duel,FALSE,"lite, exemplar, custom",main,Enchantment,Instant,uncommon,,,,x,y,,Wacky,Target Opponent,FALSE,FALSE,FALSE,FALSE,TRUE,FALSE,FALSE,FALSE,FALSE,
Premature Activation,Transform all double-sided cards on the battlefield.,,,DIFF,476,476,duel,TRUE,"exemplar, custom",main,Transmutation,Instant,common,,,,,y,,Cards,All,FALSE,FALSE,FALSE,FALSE,FALSE,FALSE,FALSE,FALSE,TRUE,
Random Royalty,"Flip a coin.<z-fc></z-fc><ul><li>If you win the flip, you become the monarch.</li><li>If you lose the flip, randomly selected opponent becomes the monarch.</li></ul>",,,Flip,477,477,multi,TRUE,"exemplar, custom",complexity,Transmutation,Instant,common,,,,,c,,Meta,Player,FALSE,FALSE,FALSE,FALSE,FALSE,FALSE,FALSE,FALSE,TRUE,
Super Shiny Pants,Each other creature becomes a copy of target nonlegendary creature until end of turn.,,,DIFF,478,478,duel,TRUE,custom,,Transmutation,Turn,uncommon,,,,,,,Cards,All,FALSE,FALSE,FALSE,FALSE,FALSE,FALSE,FALSE,FALSE,TRUE,
Myopia,"Until the end of the turn, you may only attack or target players who are sitting adjacent to you.",,,DIFF,479,479,multi,TRUE,custom,,Abjuration,Turn,common,,,,,,,Meta,Player,TRUE,FALSE,FALSE,FALSE,FALSE,FALSE,FALSE,FALSE,FALSE,
Fog of War,"Until the start of your next turn, each player may only attack or target players who are sitting adjacent to them.",,Players may only attack or target players who are sitting adjacent to them.,DIFF,480,480,multi,TRUE,"exemplar, custom",main,Abjuration,Round,uncommon,Reminder,,,,y,420,Meta,All,TRUE,FALSE,FALSE,FALSE,FALSE,FALSE,FALSE,FALSE,FALSE,
Swiper No Swiping,Ownership of target stolen card reverts to its original owner.,,,DIFF,481,481,duel,TRUE,custom,,"Enchantment, Abjuration",Instant,uncommon,,,,,,,"Cards, Meta",Player,TRUE,FALSE,FALSE,FALSE,TRUE,FALSE,FALSE,FALSE,FALSE,
Scotland Yard,Ownership of all stolen cards reverts to their original owners.,,,DIFF,482,482,duel,TRUE,"exemplar, custom",main,"Enchantment, Abjuration",Instant,uncommon,,,,,y,,"Cards, Meta",All,TRUE,FALSE,FALSE,FALSE,TRUE,FALSE,FALSE,FALSE,FALSE,
Absentminded Deck Prep,"Target player flips the top 10 cards of their library face up, then shuffles their library so the face up cards remain face up.",,,DIFF,483,483,duel,TRUE,"exemplar, custom",main,Divination,Instant,common,,,,,y,,"Cards, Meta",Player,FALSE,FALSE,FALSE,TRUE,FALSE,FALSE,FALSE,FALSE,FALSE,
ZALGO!,"Reveal a creature card from your hand and declare ""HE COMES!"". When you cast this card, it gains +2/+2 and is black. If this creature deals combat damage to a player, they must discard a card at random.",,HE COMES!<z-clearActive></z-clearActive>,DIFF,484,484,duel,TRUE,"exemplar, custom",complexity,"Divination, Transmutation",Ongoing,common,Alteration,,,,c,,Buff,Creature,FALSE,FALSE,FALSE,TRUE,FALSE,FALSE,FALSE,FALSE,TRUE,
In The Drift,"Exile two target creatures you control. Create a Jager. If the Jager leaves the battlefield, return both creatures to play under your control, untapped.","Exile two target creatures you control. Create a Jager artifact creature token with menace, reach, and has power equal to their total power, toughness equal to their total toughness, and all their abilities. If a creature exiled by this effect grants a bonus to crewed vehicles, that bonus applies to the Jager. If the Jager leaves the battlefield, return both creatures to play under your control, untapped.",,DIFF,485,485,duel,TRUE,custom,,Conjuration,Instant,uncommon,Jager,,,,,,Token,Player,FALSE,FALSE,TRUE,FALSE,FALSE,FALSE,FALSE,FALSE,FALSE,
Ma'rûf's Dreams Realized,MINIGAME,"Each player may put a non-Magic card that they own into play as a creature they control. This card's attributes are generated as follows: Colour - the predominant colour of printing on the card (yes, this can be a non-Magic colour). Toughness - a numeric value on the card. Power - a second numeric value on the card. CMC - the count of any repeated symbol on the card. If not enough source material exists, then the default values are Colorless, 1/2, CMC 0. The creature type is Outsider, and the name is whatever makes sense.",,DIFF,486,486,duel,TRUE,minigame,,Conjuration,Instant,uncommon,,,,,,MG17,"Cards, Meta",Player,FALSE,FALSE,TRUE,FALSE,FALSE,FALSE,FALSE,FALSE,FALSE,
In-Vigor-ating,"Until the start of your next turn, if damage would be dealt to a creature you control, prevent that damage. Put a +1/+1 counter on that creature for each 1 damage prevented this way.",,"If damage would be dealt to a creature [controllingPlayer] controls, prevent that damage. Put a +1/+1 counter on that creature for each 1 damage prevented this way.",DIFF,487,487,duel,TRUE,custom,,"Abjuration, Transmutation",Round,uncommon,Reminder,,,,,,Buff,Player,TRUE,FALSE,FALSE,FALSE,FALSE,FALSE,FALSE,FALSE,TRUE,
May the Odds be Ever in Your Favour,Create a Mockingjay.,"Create a colourless Mockingjay artifact token with ""<z-is>2</z-is>,<z-is>t</z-is>: Flip a coin. If you win the flip, copy target instant or sorcery and you may choose new targets for the copy. If you lose the flip, counter target instant or sorcery spell.""",,DIFF,488,488,duel,TRUE,custom,,"Conjuration, Evocation, Abjuration",Instant,common,Mockingjay,,,,,,Token,Player,TRUE,FALSE,TRUE,FALSE,FALSE,TRUE,FALSE,FALSE,FALSE,
Planar Round,"Until the start of your next turn, whenever a player casts a spell, that player flips a coin. If they lose the flip, counter that spell.",,"Whenever a player casts a spell, that player flips a coin. If they lose the flip, counter that spell.",DIFF,489,489,duel,TRUE,"exemplar, custom",soundalike,Abjuration,Round,uncommon,Reminder,,,,h,470,Cards,All,TRUE,FALSE,FALSE,FALSE,FALSE,FALSE,FALSE,FALSE,FALSE,
Planer Round,SPECIAL EFFECT,"Until the start of your next turn, any numeric value printed on a card that is higher than <z-rb>1d6</z-rb> is reduced to the rolled value.",Any numeric value printed on a card that is higher than <z-rb>1d6</z-rb> is reduced to the rolled value.,#REF!,490,490,duel,TRUE,"exemplar, custom",soundalike,Transmutation,Round,common,Reminder,,,,h,471,Meta,All,FALSE,FALSE,FALSE,FALSE,FALSE,FALSE,FALSE,FALSE,TRUE,
Plainer Round,"Until the start of your next turn, lands are Plains.",,Lands are Plains.,DIFF,491,491,duel,TRUE,"exemplar, custom",soundalike,Transmutation,Round,uncommon,Reminder,,,,h,472,Mana,All,FALSE,FALSE,FALSE,FALSE,FALSE,FALSE,FALSE,FALSE,TRUE,
X Plus One,"Until the end of your turn, all numeric values printed on cards are one higher than their printed value.",,,DIFF,492,492,duel,TRUE,"exemplar, custom",main,Transmutation,Turn,common,,,,,y,,Meta,All,FALSE,FALSE,FALSE,FALSE,FALSE,FALSE,FALSE,FALSE,TRUE,
Push ALL The Buttons!,Tap all artifacts. Copy each activated ability on each artifact with <z-is>t</z-is> in its cost.,,,DIFF,493,493,duel,TRUE,custom,,Enchantment,Instant,rare,,,,,,,Cards,Player,FALSE,FALSE,FALSE,FALSE,TRUE,FALSE,FALSE,FALSE,FALSE,
Terrestrial Upheaval,"Until the start of your next turn, whenever a player taps a land for mana, that player adds <z-rb>mana type</z-rb>.","Until the start of your next turn, whenever a player taps a land for mana, that player adds <z-rb>mana type</z-rb>.","Whenever a player taps a land for mana, that player adds <z-rb>mana type</z-rb>.",MATCH,494,494,duel,TRUE,"exemplar, custom",complexity,Evocation,Round,uncommon,Reminder,,,,c,,Mana,All,FALSE,FALSE,FALSE,FALSE,FALSE,TRUE,FALSE,FALSE,FALSE,
